filename,填写时长,投保范围_开始年龄结束年龄,投保范围_投保人符合条件集合,保险期间,等待期,缴费方式_缴费方式集合,缴费方式_是否有最低保费和最低保金要求,缴费方式_最低保费要求,缴费方式_最低保金要求,保险责任_保险责任集合,保险责任_医院和病房限制条件集合,住院费用和门诊费用的范围,保单年度累计给付限额,所有保险期间内最高给付限额,每日给付限额,保单年度内累计最高给付日,住院及手术医疗保险金_有无社保给付比例是否有区别,住院及手术医疗保险金_有社保的给付比例,住院及手术医疗保险金_无社保的给付比例,住院及手术医疗保险金_医院类型给付比例的集合,住院及手术医疗保险金_年度给付限额,门诊医疗保险金_有无社保给付比例是否有区别,门诊医疗保险金_有社保的给付比例,门诊医疗保险金_无社保的给付比例,门诊医疗保险金_医院类型给付比例的集合,门诊医疗保险金_年度给付限额,是否存在保额提升情况_单项,是否存在保额提升情况_是否有多次给付给付次数,责任免除_免除范围集合,责任免除_是否有退还,责任免除_退还条件集合,责任免除_退还金可能格式,保险人不同意续保下,续保_是否有等待期,续保_是否需要体检,续保_宽限期,续保_可续保年龄上限,续保_是否承诺续保,续保_是否有自动续保,无保险事故优惠_优惠折扣,无保险事故优惠_是否有优惠,无保险事故优惠_事故次数,保险事故通知时间_通知时间,保险事故通知时间_合作医院通知时间,保险费率的调整,合同终止与满期之间间隔限制_是否有间隔限制,合同终止与满期之间间隔限制_间隔,合同终止与满期之间间隔限制_扣除比例,合作医院_是否有合作医院,合作医院_合作医院集合,合作医院_合作医院支付比例,预授权_是否有预授权,预授权_预授权限制范围集合,预授权_需要通知时间,预授权_紧急情况通知时间,预授权_未通知给付比例,未及时核定补偿_是否有补偿,未及时核定补偿_不及时的标准,未及时核定补偿_延迟利息,险种转换_单项,险种转换_险种规定集合,险种转换_转换后是否有等待期,险种转换_等待期,险种转换_允许转换的时间,自动垫交保险费,保单备案时间
1ac5a585-2332-4ea1-94db-2676c0309aeb_TERMS.PDF,2601.0,无,身体健康、能正常参加学习的全日制在册学生及幼儿园儿童,一年,无,约定,否,无,无,被保险人因疾病住院治疗，其在住院治疗期间支出的符合社会基本医疗保险支付范围、享有社会基本医疗保险的被保险人发生属于保险责任范围内的各项费用应先向社会基本医疗保险申请支付，对于基本医疗保险免赔比例部分属于我公司保险责任、不享有社会基本医疗保险的被保险人发生的属于保险责任范围内的各项费用已通过其他途径获得补偿后扣除已获补偿后的剩余部分,中国境内（不包括香港、澳门、台湾）按国家卫生部医院等级分类中二级以上（含）公立医院，投保人与本公司协商共同指定的医院或医疗机构,诊疗费、麻醉费、手术费、抢救费、床位费、药品费、化验费、检查费、护理费、治疗费、材料费,无,无,无,无,否,无,无,10,无,否,无,无,无,无,否,无,投保人对被保险人的故意行为；被保险人故意犯罪或者抗拒依法采取的刑事强制措施；被保险人自杀、故意自伤身体；被保险人主动吸食或注射毒品；被保险人酒后驾驶，无合法有效驾驶证驾驶，或驾驶无有效行驶证的机动车；被保险人患艾滋病或感染艾滋病病毒期间；战争、军事冲突、暴乱或武装叛乱；核爆炸、核辐射或核污染；被保险人因精神疾患、酗酒或受酒精、毒品、管制药物的影响而导致的意外；被保险人因疾病、妊娠、流产、分娩(含剖腹产)、药物过敏、食物中毒、整容、医疗事故导致的伤害；被保险人未遵医嘱，私自服用、涂用、注射药物；被保险人进行潜水、滑水、滑雪、滑冰、滑翔伞、跳伞、攀岩运动、蹦极、探险活动、武术比赛、特技表演、赛马、赛车等高风险运动；被保险人从事井下作业、火药、爆竹制造等高风险工作；用于矫形、整容、美容、心理咨询、牙齿修复、牙齿整形或安装及购买残疾用具（如轮椅、假肢、助听器、配镜等）的费用；被保险人体检、疗养、康复、先天性疾病治疗费用；被保险人妊娠、流产及分娩以及由以上一个或多个原因引起的并发症所发生的医疗费用；被保险人的交通费、食宿费、生活补助费、误工补贴费；保险单签发地所在城镇的社会基本医疗保险有关规定中不予支付的费用,否,否,否,无,否,否,无,无,无,否,0,否,无,20日,无,否,否,无,无,否,无,无,否,无,,无,无,否,无,,无,无,无,无,无,无,无
efd12d35-375a-43c7-891a-8969e639b17e_TERMS.PDF,9993.0,0岁至55周岁，可续保至64周岁,不享有社会医疗保险或公费医疗保障的人群，若为零岁需为满28周天的健康出院婴儿,1年,30天,期付、全额付,否,无,无,基本部分（被保险人因疾病或意外伤害经指定医院诊断必须住院治疗的，我们就被保险人在每次住院期间实际支出的、合理且必要的、符合本主险合同责任范围的医疗费用）和可选部分（载明）,指定,以不高于约定范围外医疗费用的 50%为限，按 70%给付保险金,无,无,无,无,否,70%,70%,达成协议后的10天内,指定医院 70%,否,70%,70%,指定医院 70%,否,否,无,保险合同中特别约定的除外疾病；既往症；遗传性疾病先天性畸形、变形和染色体异常；不孕不育治疗、人工受精、怀孕、分娩、流产、堕胎、节育、 产前产后检查以及由以上原因引起的并发症；被保险人感染艾滋病疾病或患艾滋病期间因疾病导致的；精神和行为障碍 、 性病；疗养、矫形、视力矫正手术、美容、牙科保健及康复治疗、非意外事故所致整容手术；从事潜水、 跳伞、攀岩、蹦极、驾驶滑翔机或滑翔伞、探险、摔跤、武术比赛、 特技表演、赛马、赛车等高风险运动；投保人对被保险人的故意杀害、故意伤害；被保险人故意自伤、故意犯罪或者抗拒依法采取的刑事强制措施；被保险人殴斗、醉酒，主动吸食或注射毒品；被保险人酒后驾驶、 无合法有效驾驶证驾驶，或驾驶无有效行驶证的机动车 ；战争、军事冲突、暴乱或武装叛乱；核爆炸、核辐射或核污染； 入住门诊观察室、家庭病房、其他挂床住院及不合理的住院产生的医疗费用；（16）指定医院中的特需医疗、外宾医疗、干部病房所发生的医疗费用；观察病房、陪人床、家庭病床等床位费用；自购药品或凭医生处方外购药品的费用；活检、穿刺、造影等创伤性检查以及康复性手术发生的费用； ,否,无,无,60,否,否,无,64,是,否,0,否,0,10天内,10天内,否,否,无,无,是,载明,70%,否,无,,无,无,有,审核31天以后,,无,无,否,无,无,无,2012年
